measureName,measureId,submissionMethod,measureType,benchmark,standardDeviation,average,decile1,decile2,decile3,decile4,decile5,decile6,decile7,decile8,decile9,decile10,isToppedOut,isToppedOutByProgram,percentile1,percentile10,percentile20,percentile30,percentile40,percentile50,percentile60,percentile70,percentile80,percentile90,percentile99,isHighPriority,isInverse,metricType
CAHPS for MIPS SSM: Stewardship of Patient Resources,CAHPS_11,CAHPS Survey Vendor,Patient Engagement/Experience,Y,,,,,,,,,,,,,N,,9.47,18.6,20.19,21.76,23.14,24.43,25.48,26.69,28.27,30.14,99,Y,,cahps
CAHPS for MIPS SSM: Patient’s Rating of Provider,CAHPS_3,CAHPS Survey Vendor,Patient Engagement/Experience,Y,,,,,,,,,,,,,N,,82.01,89.93,90.82,91.46,91.8,92.24,92.62,93.01,93.43,93.99,99,Y,,cahps
"CAHPS for MIPS SSM: Getting Timely Care, Appointments and Information",CAHPS_1,CAHPS Survey Vendor,Patient Engagement/Experience,Y,,,,,,,,,,,,,N,,64.57,79.09,81.42,82.75,83.96,84.84,85.7,86.44,87.47,88.61,99,Y,,cahps
CAHPS for MIPS SSM: How Well Providers Communicate,CAHPS_2,CAHPS Survey Vendor,Patient Engagement/Experience,Y,,,,,,,,,,,,,N,,79.3,91.37,92.28,92.84,93.26,93.62,93.98,94.38,94.88,95.44,99,Y,,cahps
CAHPS for MIPS SSM: Care Coordination,CAHPS_8,CAHPS Survey Vendor,Patient Engagement/Experience,Y,,,,,,,,,,,,,N,,71.63,82.22,83.65,84.43,85.17,85.8,86.42,87.02,87.62,88.35,99,Y,,cahps
CAHPS for MIPS SSM: Courteous and Helpful Office Staff,CAHPS_9,CAHPS Survey Vendor,Patient Engagement/Experience,Y,,,,,,,,,,,,,N,,75.91,88.96,90.23,91.09,91.59,92.2,92.7,93.15,93.81,94.45,99,Y,,cahps
CAHPS for MIPS SSM: Health Promotion and Education,CAHPS_5,CAHPS Survey Vendor,Patient Engagement/Experience,Y,,,,,,,,,,,,,N,,46.76,55.26,57.56,59.19,60.64,61.81,62.79,63.96,65.18,66.65,99,Y,,cahps
CAHPS for MIPS SSM: Shared Decision-Making,CAHPS_6,CAHPS Survey Vendor,Patient Engagement/Experience,Y,,,,,,,,,,,,,N,,43.46,55.24,57.3,58.88,59.87,60.88,62,63.05,64.1,65.91,99,Y,,cahps
CAHPS for MIPS SSM: Access to Specialists,CAHPS_4,CAHPS Survey Vendor,Patient Engagement/Experience,Y,,,,,,,,,,,,,N,,64.01,74.12,75.49,76.79,77.79,78.86,79.87,80.73,81.81,82.99,99,Y,,cahps